Product_ID,Product_Name,Category,Description,Tags,Price
151,Boho Candle,Home Decor,Boho Candle that adds character and warmth to any mid-century modern space.,"artisan, cozy, modern, interior-design, rustic, aesthetic, home-decor",57.75
152,Wireless Monitor,Gaming,Wireless Monitor engineered for competitive gaming with ultra-low latency.,"fps, rgb, peripheral, controller, gaming",562.46
153,Pro Webcam,Electronics,High-performance Pro Webcam with advanced noise-cancellation and HD video support.,"gadget, noise-cancelling, productivity, portable, tech, electronics",320.0
154,Advanced Atlas,Books,This bestselling Advanced Atlas on data science has transformed how professionals learn.,"education, fiction, book, bestseller, books",53.18
155,Professional Dumbbells,Fitness,Build strength at home with this Professional Dumbbells — perfect for HIIT routines.,"recovery, fitness, yoga, exercise, strength, workout",152.63
156,BPA-Free Coffee Maker,Kitchen,BPA-Free Coffee Maker built for precision slicing — perfect for everyday cooking and entertaining.,"food, eco-friendly, healthy-eating, kitchen",176.18
157,Organic Shorts,Clothing,Versatile Organic Shorts that transitions seamlessly from outdoor adventures to casual wear.,"comfort, organic, apparel, sportswear, style, clothing",86.94
158,Hydrating Eye Cream,Beauty,Luxury skincare: Hydrating Eye Cream packed with actives for pore minimizing.,"vegan, moisturizing, clean-beauty, skincare, beauty",93.7
159,Coastal Rug,Home Decor,Elegant Coastal Rug designed to complement minimalist interior styles.,"artisan, home-decor, interior-design, boho, rustic",122.44
160,Ergonomic Controller,Gaming,Ergonomic Controller engineered for competitive gaming with anti-ghosting.,"fps, controller, peripheral, gaming",189.3
161,Wireless Speaker,Electronics,Experience crystal-clear audio with this Wireless Speaker featuring ergonomic design.,"ergonomic, audio, smart, noise-cancelling, wireless, electronics",212.27
162,Advanced Journal,Books,This bestselling Advanced Journal on data science has transformed how professionals learn.,"bestseller, fiction, reading, books",37.88
163,Adjustable Yoga Mat,Fitness,Elevate your workout with this Adjustable Yoga Mat optimized for flexibility exercises.,"fitness, training, workout",218.36
164,Cast Iron Food Processor,Kitchen,"Cook smarter with this Cast Iron Food Processor, ideal for pressure cooking.","eco-friendly, kitchen, meal-prep, food, appliance",49.93
165,Windproof Track Pants,Clothing,Windproof Track Pants crafted for yoga sessions with premium sustainable materials.,"sustainable, activewear, clothing, eco-friendly, sportswear, fashion",88.14
166,Soothing Face Wash,Beauty,Soothing Face Wash formulated with natural ingredients for sensitive skin.,"organic, beauty, cruelty-free",43.81
167,Scandinavian Table Lamp,Home Decor,Elegant Scandinavian Table Lamp designed to complement Scandinavian interior styles.,"home-decor, minimalist, boho, rustic, cozy, artisan",138.48
168,Ergonomic Mouse Pad,Gaming,Dominate the game with this Ergonomic Mouse Pad featuring surround sound.,"mmorpg, controller, pc-gaming, fps, peripheral, rgb, gaming",190.47
169,AI-Powered Charger,Electronics,"Engineered for professionals, this AI-Powered Charger delivers ergonomic design and seamless connectivity.","portable, wireless, ergonomic, bluetooth, electronics",186.24
170,Beginner's Workbook,Books,This bestselling Beginner's Workbook on economics has transformed how professionals learn.,"reading, nonfiction, study, learning, books",15.45
171,Premium Exercise Bike,Fitness,Build strength at home with this Premium Exercise Bike — perfect for flexibility exercises.,"training, home-gym, health, fitness",196.8
172,Insulated Instant Pot,Kitchen,The Insulated Instant Pot every kitchen needs for baking.,"baking, kitchen, cooking, meal-prep, appliance",91.25
173,Slim-Fit Joggers,Clothing,"Stay comfortable all day in this Slim-Fit Joggers, designed for office wear.","organic, style, apparel, clothing",141.75
174,Anti-Aging Moisturizer,Beauty,Achieve glowing skin with this Anti-Aging Moisturizer designed for daily hydration.,"moisturizing, spf, cruelty-free, beauty",118.78
175,Artisan Rug,Home Decor,Hand-crafted Artisan Rug inspired by minimalist design traditions.,"rustic, boho, interior-design, minimalist, artisan, cozy, home-decor",167.34
176,Wireless Gaming Mouse,Gaming,Professional-grade Wireless Gaming Mouse built for anti-ghosting and marathon sessions.,"rgb, streamer, peripheral, fps, gaming",213.55
177,4K Laptop Stand,Electronics,Experience crystal-clear audio with this 4K Laptop Stand featuring fast charging.,"usb-c, audio, gadget, wireless, electronics",145.17
178,Illustrated Compendium,Books,From basics to mastery: the Illustrated Compendium for anyone interested in creative writing.,"study, book, nonfiction, fiction, education, books",44.63
179,Professional Resistance Bands,Fitness,"Durable and versatile, the Professional Resistance Bands supports yoga practice training regimens.","cardio, home-gym, exercise, gym, fitness",197.02
180,Cast Iron Cutting Board,Kitchen,Professional-grade Cast Iron Cutting Board engineered for baking and easy cleanup.,"eco-friendly, food, appliance, meal-prep, kitchen",346.23
181,Relaxed Track Pants,Clothing,Relaxed Track Pants crafted for everyday comfort with premium sustainable materials.,"eco-friendly, sportswear, apparel, fashion, clothing",62.65
182,Nourishing Body Lotion,Beauty,Dermatologist-tested Nourishing Body Lotion for anti-aging benefits and long-lasting radiance.,"skincare, clean-beauty, cruelty-free, anti-aging, beauty, organic",23.64
183,Industrial Mirror,Home Decor,Elegant Industrial Mirror designed to complement living room interior styles.,"home-decor, handmade, rustic, cozy, aesthetic",190.25
184,RGB Gaming Mouse,Gaming,Professional-grade RGB Gaming Mouse built for hot-swap switches and marathon sessions.,"peripheral, gaming, esports",592.02
185,4K Earbuds,Electronics,Next-generation 4K Earbuds powered by AI with ergonomic design.,"noise-cancelling, ergonomic, productivity, electronics",83.83
186,Beginner's Atlas,Books,"Packed with insights, this Beginner's Atlas explores biohacking in depth.","reference, knowledge, fiction, learning, books",23.77
187,Premium Resistance Bands,Fitness,Elevate your workout with this Premium Resistance Bands optimized for full-body workouts.,"health, training, gym, fitness",43.75
188,Non-Stick Instant Pot,Kitchen,Professional-grade Non-Stick Instant Pot engineered for meal prep and easy cleanup.,"healthy-eating, eco-friendly, chef, kitchen",194.89
189,Recycled Jacket,Clothing,Versatile Recycled Jacket that transitions seamlessly from office wear to casual wear.,"clothing, sportswear, apparel, comfort, organic",75.53
190,Purifying Moisturizer,Beauty,Luxury skincare: Purifying Moisturizer packed with actives for brightening.,"anti-aging, glow, vegan, cruelty-free, organic, beauty",29.4
191,Coastal Bookshelf,Home Decor,Hand-crafted Coastal Bookshelf inspired by bedroom design traditions.,"rustic, handmade, home-decor",220.29
192,Ergonomic GPU Cooler,Gaming,The Ergonomic GPU Cooler trusted by esports pros — delivers 6-axis tracking.,"mmorpg, fps, gaming, esports",563.86
193,Bluetooth Microphone,Electronics,Experience crystal-clear audio with this Bluetooth Microphone featuring low-latency streaming.,"audio, smart, wireless, gadget, tech, electronics",27.78
194,Illustrated Manual,Books,"Packed with insights, this Illustrated Manual explores psychology in depth.","reading, book, study, bestseller, books",52.32
195,Foldable Dumbbells,Fitness,Elevate your workout with this Foldable Dumbbells optimized for full-body workouts.,"training, health, gym, workout, fitness",17.6
196,Cast Iron Pan,Kitchen,"Cook smarter with this Cast Iron Pan, ideal for batch cooking.","cooking, appliance, food, nonstick, kitchen",77.67
197,Organic Leggings,Clothing,Organic Leggings crafted for everyday comfort with premium sustainable materials.,"organic, eco-friendly, sportswear, clothing",91.84
198,Hydrating Moisturizer,Beauty,Hydrating Moisturizer formulated with natural ingredients for oil control.,"anti-aging, moisturizing, skincare, spf, beauty, cruelty-free",32.46
199,Coastal Picture Frame,Home Decor,Coastal Picture Frame that adds character and warmth to any living room space.,"cozy, home-decor, minimalist, handmade, artisan",18.67
200,Wired Stream Deck,Gaming,The Wired Stream Deck trusted by esports pros — delivers anti-ghosting.,"esports, peripheral, mmorpg, gaming",81.16
201,Pro Speaker,Electronics,Next-generation Pro Speaker powered by AI with low-latency streaming.,"wireless, noise-cancelling, portable, usb-c, productivity, electronics",129.5
202,Advanced Primer,Books,This bestselling Advanced Primer on biohacking has transformed how professionals learn.,"learning, nonfiction, reference, fiction, book, bestseller, books",23.39
203,Resistance Yoga Mat,Fitness,"Durable and versatile, the Resistance Yoga Mat supports recovery sessions training regimens.","gym, training, fitness, exercise, health",117.57
204,Cast Iron Pot,Kitchen,Cast Iron Pot built for quick sautéing — perfect for everyday cooking and entertaining.,"healthy-eating, eco-friendly, appliance, kitchen",21.84
205,Stretch Sweatshirt,Clothing,Versatile Stretch Sweatshirt that transitions seamlessly from everyday comfort to casual wear.,"clothing, sustainable, organic, activewear, eco-friendly, sportswear",137.67
206,SPF-Protected Exfoliant,Beauty,Luxury skincare: SPF-Protected Exfoliant packed with actives for oil control.,"vegan, spf, clean-beauty, glow, beauty",63.73
207,Coastal Planter,Home Decor,Elegant Coastal Planter designed to complement Scandinavian interior styles.,"minimalist, rustic, home-decor",237.96
208,Pro GPU Cooler,Gaming,Professional-grade Pro GPU Cooler built for hot-swap switches and marathon sessions.,"mmorpg, streamer, rgb, controller, peripheral, fps, gaming",569.68
209,Pro Earbuds,Electronics,Experience crystal-clear audio with this Pro Earbuds featuring low-latency streaming.,"audio, portable, usb-c, gadget, ergonomic, productivity, electronics",154.53
210,Definitive Primer,Books,A Definitive Primer covering software engineering with real-world examples and exercises.,"study, reading, education, fiction, books",48.37
211,Professional Ab Wheel,Fitness,Elevate your workout with this Professional Ab Wheel optimized for flexibility exercises.,"gym, cardio, yoga, workout, strength, fitness",101.3
212,Cast Iron Dutch Oven,Kitchen,"Cook smarter with this Cast Iron Dutch Oven, ideal for quick sautéing.","cooking, eco-friendly, nonstick, baking, chef, healthy-eating, kitchen",183.72
213,Windproof Sweatshirt,Clothing,Versatile Windproof Sweatshirt that transitions seamlessly from athletic performance to casual wear.,"fashion, activewear, comfort, clothing",41.61
214,Hydrating Exfoliant,Beauty,Achieve glowing skin with this Hydrating Exfoliant designed for pore minimizing.,"skincare, beauty, glow, vegan, cruelty-free, spf",91.89
215,Artisan Planter,Home Decor,Elegant Artisan Planter designed to complement Scandinavian interior styles.,"handmade, artisan, minimalist, cozy, home-decor",128.44
216,Ultra-Light Monitor,Gaming,Ultra-Light Monitor engineered for competitive gaming with customizable RGB lighting.,"mmorpg, fps, pc-gaming, mechanical, gaming",475.95
217,AI-Powered Earbuds,Electronics,Next-generation AI-Powered Earbuds powered by AI with low-latency streaming.,"usb-c, ergonomic, audio, electronics",52.23
218,Essential Handbook,Books,From basics to mastery: the Essential Handbook for anyone interested in machine learning.,"education, reference, study, books",37.59
219,Adjustable Balance Board,Fitness,Elevate your workout with this Adjustable Balance Board optimized for recovery sessions.,"cardio, workout, recovery, training, fitness",127.73
220,Multi-Function Instant Pot,Kitchen,"Cook smarter with this Multi-Function Instant Pot, ideal for smoothie making.","chef, appliance, baking, kitchen",266.52
221,Thermal Track Pants,Clothing,"Stay comfortable all day in this Thermal Track Pants, designed for everyday comfort.","fashion, activewear, sustainable, clothing, eco-friendly",68.52
222,Vegan Face Mask,Beauty,Luxury skincare: Vegan Face Mask packed with actives for pore minimizing.,"glow, anti-aging, clean-beauty, skincare, beauty",63.01
223,Artisan Bookshelf,Home Decor,Artisan Bookshelf that adds character and warmth to any eclectic space.,"cozy, boho, handmade, home-decor, modern, interior-design",84.95
224,Mechanical Capture Card,Gaming,Professional-grade Mechanical Capture Card built for surround sound and marathon sessions.,"controller, esports, mechanical, gaming",145.67
225,Portable USB Hub,Electronics,Experience crystal-clear audio with this Portable USB Hub featuring ergonomic design.,"gadget, ergonomic, wireless, audio, electronics",275.48
226,Complete Manual,Books,This bestselling Complete Manual on history has transformed how professionals learn.,"fiction, reference, bestseller, reading, books",17.1
227,Premium Jump Rope,Fitness,Elevate your workout with this Premium Jump Rope optimized for recovery sessions.,"gym, training, cardio, exercise, strength, workout, fitness",144.58
228,Ceramic Coffee Maker,Kitchen,Professional-grade Ceramic Coffee Maker engineered for pressure cooking and easy cleanup.,"meal-prep, kitchen, nonstick, eco-friendly, appliance, chef",18.48
229,Moisture-Wicking Vest,Clothing,Moisture-Wicking Vest crafted for weekend lounging with premium sustainable materials.,"activewear, apparel, sustainable, fashion, sportswear, clothing",105.09
230,Anti-Aging Serum,Beauty,Dermatologist-tested Anti-Aging Serum for brightening and long-lasting radiance.,"anti-aging, spf, organic, beauty",56.63
231,Vintage Throw Pillow,Home Decor,Hand-crafted Vintage Throw Pillow inspired by coastal design traditions.,"interior-design, boho, handmade, home-decor, modern, artisan",39.24
232,Pro Mouse Pad,Gaming,The Pro Mouse Pad trusted by esports pros — delivers tactile switches.,"rgb, esports, gaming, fps",398.75
233,Bluetooth Webcam,Electronics,Experience crystal-clear audio with this Bluetooth Webcam featuring USB-C connectivity.,"streaming, noise-cancelling, usb-c, gadget, bluetooth, wireless, electronics",87.2
234,Essential Journal,Books,From basics to mastery: the Essential Journal for anyone interested in biohacking.,"fiction, education, reference, reading, study, book, books",22.4
235,Compact Exercise Bike,Fitness,"Compact Exercise Bike designed for home and gym use, featuring HIIT routines.","health, home-gym, recovery, training, strength, fitness",126.64
236,Non-Stick Air Fryer,Kitchen,"Cook smarter with this Non-Stick Air Fryer, ideal for precision slicing.","chef, eco-friendly, cooking, kitchen",191.02
237,Recycled Polo,Clothing,Performance-ready Recycled Polo built for office wear in any weather.,"sportswear, eco-friendly, apparel, clothing",56.06
238,SPF-Protected Moisturizer,Beauty,SPF-Protected Moisturizer formulated with natural ingredients for sensitive skin.,"skincare, cruelty-free, beauty, vegan, moisturizing, glow",22.25
239,Modern Throw Pillow,Home Decor,"Transform your room with this Modern Throw Pillow, perfect for living room aesthetics.","rustic, cozy, interior-design, minimalist, modern, aesthetic, home-decor",162.46
240,Optical Capture Card,Gaming,Optical Capture Card engineered for competitive gaming with anti-ghosting.,"pc-gaming, rgb, mmorpg, esports, peripheral, gaming",539.19
241,Smart Keyboard,Electronics,High-performance Smart Keyboard with advanced noise-cancellation and 40-hour battery life.,"gadget, wireless, usb-c, electronics",194.7
242,Illustrated Workbook,Books,From basics to mastery: the Illustrated Workbook for anyone interested in astronomy.,"knowledge, fiction, study, bestseller, books",48.78
243,Premium Balance Board,Fitness,Build strength at home with this Premium Balance Board — perfect for flexibility exercises.,"cardio, fitness, health",169.33
244,Non-Stick Cutting Board,Kitchen,"Cook smarter with this Non-Stick Cutting Board, ideal for meal prep.","cooking, chef, nonstick, eco-friendly, healthy-eating, kitchen",336.91
245,Moisture-Wicking Leggings,Clothing,Moisture-Wicking Leggings crafted for everyday comfort with premium sustainable materials.,"sportswear, organic, comfort, activewear, clothing",146.68
246,Organic Exfoliant,Beauty,Dermatologist-tested Organic Exfoliant for anti-aging benefits and long-lasting radiance.,"skincare, beauty, anti-aging, moisturizing, glow, cruelty-free",41.37
247,Vintage Table Lamp,Home Decor,"Transform your room with this Vintage Table Lamp, perfect for mid-century modern aesthetics.","rustic, boho, interior-design, artisan, handmade, aesthetic, home-decor",40.6
248,RGB Headset,Gaming,The RGB Headset trusted by esports pros — delivers 60Hz+ refresh rate.,"streamer, esports, mmorpg, pc-gaming, peripheral, gaming",284.84
249,Bluetooth Mouse,Electronics,High-performance Bluetooth Mouse with advanced noise-cancellation and fast charging.,"noise-cancelling, portable, streaming, wireless, electronics",123.2
250,Definitive Manual,Books,"Packed with insights, this Definitive Manual explores machine learning in depth.","reading, study, reference, book, knowledge, bestseller, books",50.18
251,Resistance Jump Rope,Fitness,"Resistance Jump Rope designed for home and gym use, featuring cardio sessions.","recovery, health, fitness, exercise, home-gym",245.46
252,Ceramic Food Processor,Kitchen,The Ceramic Food Processor every kitchen needs for meal prep.,"appliance, chef, eco-friendly, baking, kitchen",117.14
253,Breathable T-Shirt,Clothing,Breathable T-Shirt crafted for everyday comfort with premium sustainable materials.,"eco-friendly, activewear, clothing, sustainable",82.13
254,Brightening Exfoliant,Beauty,Dermatologist-tested Brightening Exfoliant for sensitive skin and long-lasting radiance.,"vegan, moisturizing, beauty, cruelty-free, skincare",74.1
255,Vintage Picture Frame,Home Decor,Vintage Picture Frame that adds character and warmth to any bedroom space.,"handmade, artisan, aesthetic, home-decor",242.73
256,Wired Capture Card,Gaming,Professional-grade Wired Capture Card built for hot-swap switches and marathon sessions.,"esports, controller, mechanical, pc-gaming, peripheral, gaming",484.53
257,Wireless Mouse,Electronics,"Engineered for professionals, this Wireless Mouse delivers 40-hour battery life and seamless connectivity.","bluetooth, ergonomic, audio, tech, smart, electronics",97.22
258,Complete Encyclopedia,Books,"Packed with insights, this Complete Encyclopedia explores philosophy in depth.","nonfiction, study, reference, book, bestseller, books",29.64
259,Compact Ab Wheel,Fitness,"Compact Ab Wheel designed for home and gym use, featuring cardio sessions.","fitness, cardio, gym, exercise, recovery",203.67
260,Cast Iron Knife Set,Kitchen,"Cook smarter with this Cast Iron Knife Set, ideal for precision slicing.","cooking, nonstick, healthy-eating, appliance, food, kitchen",311.4
261,Stretch Joggers,Clothing,Stretch Joggers crafted for weekend lounging with premium sustainable materials.,"style, eco-friendly, sustainable, fashion, apparel, clothing",93.34
262,Vegan Serum,Beauty,Achieve glowing skin with this Vegan Serum designed for anti-aging benefits.,"glow, organic, beauty, anti-aging, clean-beauty, spf",55.46
263,Industrial Vase,Home Decor,"Transform your room with this Industrial Vase, perfect for home office aesthetics.","interior-design, aesthetic, handmade, rustic, boho, home-decor",144.72
264,Ultra-Light Stream Deck,Gaming,Ultra-Light Stream Deck engineered for competitive gaming with 60Hz+ refresh rate.,"esports, streamer, rgb, pc-gaming, fps, mmorpg, gaming",360.03
265,Smart Speaker,Electronics,"Engineered for professionals, this Smart Speaker delivers fast charging and seamless connectivity.","smart, portable, ergonomic, usb-c, productivity, electronics",37.97
266,Essential Encyclopedia,Books,This bestselling Essential Encyclopedia on economics has transformed how professionals learn.,"knowledge, reading, fiction, bestseller, book, nonfiction, books",49.56
267,Professional Jump Rope,Fitness,Build strength at home with this Professional Jump Rope — perfect for recovery sessions.,"workout, health, recovery, fitness",253.53
268,Ceramic Cutting Board,Kitchen,The Ceramic Cutting Board every kitchen needs for quick sautéing.,"baking, kitchen, healthy-eating",29.72
269,Organic Jacket,Clothing,"Stay comfortable all day in this Organic Jacket, designed for travel.","organic, sportswear, clothing, eco-friendly, comfort",21.15
270,Purifying Eye Cream,Beauty,Luxury skincare: Purifying Eye Cream packed with actives for sensitive skin.,"clean-beauty, anti-aging, skincare, beauty, spf",119.93
271,Vintage Rug,Home Decor,"Transform your room with this Vintage Rug, perfect for bohemian aesthetics.","artisan, interior-design, modern, home-decor",247.25
272,Wired Gaming Chair,Gaming,Wired Gaming Chair engineered for competitive gaming with tactile switches.,"fps, pc-gaming, streamer, mechanical, controller, gaming",360.23
273,Compact Charger,Electronics,"Engineered for professionals, this Compact Charger delivers low-latency streaming and seamless connectivity.","streaming, portable, usb-c, bluetooth, ergonomic, electronics",45.75
274,Beginner's Guide,Books,This bestselling Beginner's Guide on history has transformed how professionals learn.,"fiction, bestseller, knowledge, learning, books",25.81
275,Premium Yoga Mat,Fitness,Elevate your workout with this Premium Yoga Mat optimized for core training.,"training, workout, strength, fitness, yoga",143.83
276,Multi-Function Blender,Kitchen,"Cook smarter with this Multi-Function Blender, ideal for quick sautéing.","food, healthy-eating, nonstick, kitchen",148.93
277,Breathable Polo,Clothing,Breathable Polo crafted for athletic performance with premium sustainable materials.,"comfort, clothing, eco-friendly, organic",128.31
278,Brightening Body Lotion,Beauty,Dermatologist-tested Brightening Body Lotion for brightening and long-lasting radiance.,"anti-aging, beauty, organic, skincare",89.71
279,Scandinavian Vase,Home Decor,Hand-crafted Scandinavian Vase inspired by living room design traditions.,"modern, home-decor, handmade",220.98
280,Wired Mechanical Keyboard,Gaming,The Wired Mechanical Keyboard trusted by esports pros — delivers surround sound.,"mechanical, gaming, fps, pc-gaming",405.45
281,AI-Powered Mouse,Electronics,Next-generation AI-Powered Mouse powered by AI with multi-device pairing.,"productivity, streaming, bluetooth, electronics",155.69
282,Definitive Workbook,Books,From basics to mastery: the Definitive Workbook for anyone interested in software engineering.,"learning, study, book, knowledge, reading, fiction, books",26.42
283,Adjustable Kettlebell,Fitness,Elevate your workout with this Adjustable Kettlebell optimized for yoga practice.,"gym, workout, fitness, recovery",44.55
284,Insulated Food Processor,Kitchen,Professional-grade Insulated Food Processor engineered for precision slicing and easy cleanup.,"meal-prep, kitchen, food, chef, healthy-eating, nonstick",312.11
285,Relaxed Polo,Clothing,Performance-ready Relaxed Polo built for travel in any weather.,"organic, apparel, clothing, style, comfort",141.46
286,Purifying Toner,Beauty,Purifying Toner formulated with natural ingredients for overnight repair.,"organic, beauty, moisturizing",48.41
287,Modern Rug,Home Decor,"Transform your room with this Modern Rug, perfect for eclectic aesthetics.","home-decor, minimalist, artisan",48.0
288,Ergonomic Gaming Chair,Gaming,The Ergonomic Gaming Chair trusted by esports pros — delivers customizable RGB lighting.,"pc-gaming, esports, controller, gaming",287.99
289,AI-Powered Monitor,Electronics,High-performance AI-Powered Monitor with advanced noise-cancellation and touch controls.,"productivity, smart, streaming, electronics",251.8
290,Advanced Manual,Books,This bestselling Advanced Manual on astronomy has transformed how professionals learn.,"learning, bestseller, fiction, nonfiction, books",54.06
291,Compact Balance Board,Fitness,Elevate your workout with this Compact Balance Board optimized for flexibility exercises.,"home-gym, exercise, fitness, cardio",125.44
292,Ceramic Toaster,Kitchen,Ceramic Toaster built for meal prep — perfect for everyday cooking and entertaining.,"chef, eco-friendly, appliance, meal-prep, healthy-eating, kitchen",252.11
293,Stretch Track Pants,Clothing,"Stay comfortable all day in this Stretch Track Pants, designed for travel.","style, apparel, fashion, eco-friendly, organic, clothing",115.55
294,Organic Lip Balm,Beauty,Luxury skincare: Organic Lip Balm packed with actives for daily hydration.,"clean-beauty, spf, vegan, skincare, glow, beauty",102.9
295,Minimalist Bookshelf,Home Decor,Hand-crafted Minimalist Bookshelf inspired by minimalist design traditions.,"minimalist, modern, home-decor",196.8
296,Ultra-Light Capture Card,Gaming,Ultra-Light Capture Card engineered for competitive gaming with anti-ghosting.,"peripheral, mechanical, rgb, fps, gaming",477.09
297,Ultra Charger,Electronics,High-performance Ultra Charger with advanced noise-cancellation and ergonomic design.,"gadget, ergonomic, audio, streaming, productivity, electronics",160.91
298,Definitive Journal,Books,"Packed with insights, this Definitive Journal explores psychology in depth.","learning, fiction, knowledge, books",22.01
299,Heavy-Duty Balance Board,Fitness,"Heavy-Duty Balance Board designed for home and gym use, featuring full-body workouts.","training, health, cardio, gym, fitness",73.58
300,Non-Stick Blender,Kitchen,Non-Stick Blender built for deep frying — perfect for everyday cooking and entertaining.,"baking, healthy-eating, nonstick, chef, kitchen",225.37
