Product_ID,Product_Name,Category,Description,Tags,Price
301,Windproof Shorts,Clothing,Performance-ready Windproof Shorts built for athletic performance in any weather.,"sportswear, clothing, fashion",118.26
302,Hydrating Serum,Beauty,Hydrating Serum formulated with natural ingredients for brightening.,"spf, skincare, glow, anti-aging, organic, beauty",51.33
303,Minimalist Mirror,Home Decor,Hand-crafted Minimalist Mirror inspired by home office design traditions.,"handmade, cozy, rustic, modern, home-decor",48.85
304,Pro Gaming Mouse,Gaming,Pro Gaming Mouse engineered for competitive gaming with tactile switches.,"gaming, streamer, esports",200.19
305,Portable Keyboard,Electronics,Experience crystal-clear audio with this Portable Keyboard featuring ergonomic design.,"tech, gadget, streaming, portable, electronics",113.27
306,Illustrated Journal,Books,"Packed with insights, this Illustrated Journal explores machine learning in depth.","nonfiction, learning, study, books",14.9
307,Heavy-Duty Foam Roller,Fitness,Elevate your workout with this Heavy-Duty Foam Roller optimized for yoga practice.,"recovery, exercise, workout, strength, cardio, fitness",105.14
308,BPA-Free Blender,Kitchen,The BPA-Free Blender every kitchen needs for meal prep.,"chef, healthy-eating, baking, nonstick, kitchen",134.14
309,Stretch Vest,Clothing,Performance-ready Stretch Vest built for weekend lounging in any weather.,"sustainable, style, fashion, sportswear, comfort, clothing",98.85
310,Soothing Exfoliant,Beauty,Soothing Exfoliant formulated with natural ingredients for sensitive skin.,"clean-beauty, glow, cruelty-free, moisturizing, skincare, beauty",49.6
311,Minimalist Vase,Home Decor,Hand-crafted Minimalist Vase inspired by minimalist design traditions.,"rustic, modern, boho, home-decor",25.05
312,Ergonomic Stream Deck,Gaming,The Ergonomic Stream Deck trusted by esports pros — delivers anti-ghosting.,"controller, gaming, peripheral, mmorpg, rgb, pc-gaming",429.64
313,AI-Powered Laptop Stand,Electronics,"Engineered for professionals, this AI-Powered Laptop Stand delivers HD video support and seamless connectivity.","smart, noise-cancelling, ergonomic, audio, electronics",302.08
314,Illustrated Encyclopedia,Books,This bestselling Illustrated Encyclopedia on biohacking has transformed how professionals learn.,"study, reading, nonfiction, learning, books",46.2
315,Adjustable Ab Wheel,Fitness,Build strength at home with this Adjustable Ab Wheel — perfect for core training.,"cardio, workout, gym, fitness, home-gym, exercise",259.97
316,Non-Stick Dutch Oven,Kitchen,"Cook smarter with this Non-Stick Dutch Oven, ideal for smoothie making.","kitchen, nonstick, healthy-eating, cooking, chef",279.07
317,Windproof Jacket,Clothing,Performance-ready Windproof Jacket built for running in any weather.,"fashion, apparel, organic, comfort, sustainable, clothing",52.96
318,Anti-Aging Eye Cream,Beauty,Luxury skincare: Anti-Aging Eye Cream packed with actives for brightening.,"skincare, organic, cruelty-free, anti-aging, beauty",86.61
319,Minimalist Table Lamp,Home Decor,"Transform your room with this Minimalist Table Lamp, perfect for coastal aesthetics.","minimalist, artisan, cozy, home-decor",17.51
320,Ultra-Light Controller,Gaming,Dominate the game with this Ultra-Light Controller featuring ultra-low latency.,"gaming, mmorpg, mechanical, peripheral",25.16
321,Ultra Speaker,Electronics,Next-generation Ultra Speaker powered by AI with HD video support.,"noise-cancelling, smart, ergonomic, gadget, wireless, electronics",373.71
322,Complete Anthology,Books,From basics to mastery: the Complete Anthology for anyone interested in data science.,"knowledge, bestseller, study, reading, learning, books",47.86
323,Premium Foam Roller,Fitness,Build strength at home with this Premium Foam Roller — perfect for core training.,"strength, training, health, exercise, gym, recovery, fitness",209.68
324,Ceramic Blender,Kitchen,Ceramic Blender built for slow cooking — perfect for everyday cooking and entertaining.,"eco-friendly, kitchen, nonstick",298.77
325,Breathable Hoodie,Clothing,Versatile Breathable Hoodie that transitions seamlessly from weekend lounging to casual wear.,"comfort, eco-friendly, sustainable, apparel, clothing",73.52
326,Soothing Eye Cream,Beauty,Achieve glowing skin with this Soothing Eye Cream designed for overnight repair.,"anti-aging, vegan, clean-beauty, glow, beauty, skincare",89.77
327,Industrial Rug,Home Decor,Industrial Rug that adds character and warmth to any bedroom space.,"aesthetic, minimalist, interior-design, modern, boho, home-decor",87.69
328,Wired Monitor,Gaming,Dominate the game with this Wired Monitor featuring 6-axis tracking.,"streamer, mechanical, fps, gaming, peripheral, esports",322.04
329,Compact Mouse,Electronics,Next-generation Compact Mouse powered by AI with HD video support.,"bluetooth, tech, noise-cancelling, portable, electronics",72.96
330,Essential Workbook,Books,This bestselling Essential Workbook on creative writing has transformed how professionals learn.,"book, reference, learning, knowledge, study, reading, books",20.85
331,Premium Pull-Up Bar,Fitness,Elevate your workout with this Premium Pull-Up Bar optimized for recovery sessions.,"fitness, health, yoga, gym",163.51
332,Multi-Function Cutting Board,Kitchen,Professional-grade Multi-Function Cutting Board engineered for meal prep and easy cleanup.,"chef, healthy-eating, meal-prep, kitchen",18.07
333,Stretch Hoodie,Clothing,"Stay comfortable all day in this Stretch Hoodie, designed for travel.","fashion, comfort, clothing, style, apparel, eco-friendly",111.16
334,Soothing Toner,Beauty,Achieve glowing skin with this Soothing Toner designed for oil control.,"cruelty-free, glow, spf, beauty",69.23
335,Coastal Vase,Home Decor,"Transform your room with this Coastal Vase, perfect for home office aesthetics.","artisan, rustic, minimalist, home-decor, cozy",51.42
336,Ultra-Light Mouse Pad,Gaming,The Ultra-Light Mouse Pad trusted by esports pros — delivers anti-ghosting.,"peripheral, streamer, rgb, gaming",532.68
337,Portable Microphone,Electronics,"Engineered for professionals, this Portable Microphone delivers USB-C connectivity and seamless connectivity.","noise-cancelling, productivity, smart, electronics",111.13
338,Definitive Guide,Books,From basics to mastery: the Definitive Guide for anyone interested in astronomy.,"learning, nonfiction, study, books",57.22
339,Compact Resistance Bands,Fitness,Build strength at home with this Compact Resistance Bands — perfect for core training.,"health, training, home-gym, recovery, exercise, strength, fitness",285.03
340,BPA-Free Pot,Kitchen,"Cook smarter with this BPA-Free Pot, ideal for pressure cooking.","cooking, food, nonstick, baking, chef, healthy-eating, kitchen",126.73
341,Moisture-Wicking Sweatshirt,Clothing,Versatile Moisture-Wicking Sweatshirt that transitions seamlessly from weekend lounging to casual wear.,"sportswear, comfort, eco-friendly, activewear, style, clothing",75.97
342,Anti-Aging Face Mask,Beauty,Anti-Aging Face Mask formulated with natural ingredients for oil control.,"cruelty-free, moisturizing, vegan, beauty",24.35
343,Vintage Planter,Home Decor,Hand-crafted Vintage Planter inspired by Scandinavian design traditions.,"rustic, interior-design, handmade, aesthetic, cozy, home-decor",187.54
344,Wireless Headset,Gaming,Wireless Headset engineered for competitive gaming with anti-ghosting.,"pc-gaming, gaming, streamer, rgb, peripheral, mechanical",313.54
345,Ultra Microphone,Electronics,Next-generation Ultra Microphone powered by AI with multi-device pairing.,"usb-c, smart, streaming, gadget, electronics",289.35
346,Illustrated Handbook,Books,A Illustrated Handbook covering data science with real-world examples and exercises.,"study, education, nonfiction, book, books",27.15
347,Foldable Resistance Bands,Fitness,Elevate your workout with this Foldable Resistance Bands optimized for HIIT routines.,"fitness, strength, health, home-gym, gym, exercise",164.12
348,Cast Iron Toaster,Kitchen,Professional-grade Cast Iron Toaster engineered for precision slicing and easy cleanup.,"healthy-eating, nonstick, kitchen",99.08
349,Slim-Fit Leggings,Clothing,Versatile Slim-Fit Leggings that transitions seamlessly from travel to casual wear.,"style, clothing, fashion",70.51
350,SPF-Protected Face Mask,Beauty,SPF-Protected Face Mask formulated with natural ingredients for UV protection.,"anti-aging, beauty, spf, skincare, glow",46.93
351,Industrial Candle,Home Decor,Elegant Industrial Candle designed to complement bedroom interior styles.,"handmade, boho, minimalist, cozy, home-decor",243.07
352,Mechanical GPU Cooler,Gaming,Dominate the game with this Mechanical GPU Cooler featuring surround sound.,"mechanical, gaming, mmorpg, peripheral",420.67
353,Pro Headphones,Electronics,High-performance Pro Headphones with advanced noise-cancellation and ergonomic design.,"smart, gadget, noise-cancelling, streaming, bluetooth, electronics",104.99
354,Beginner's Anthology,Books,A Beginner's Anthology covering biohacking with real-world examples and exercises.,"knowledge, study, book, books",53.88
355,Foldable Jump Rope,Fitness,Build strength at home with this Foldable Jump Rope — perfect for yoga practice.,"exercise, recovery, fitness, workout, health, strength",143.72
356,Stainless Steel Blender,Kitchen,Professional-grade Stainless Steel Blender engineered for batch cooking and easy cleanup.,"healthy-eating, meal-prep, eco-friendly, kitchen, cooking, chef",211.93
357,Moisture-Wicking Joggers,Clothing,"Stay comfortable all day in this Moisture-Wicking Joggers, designed for outdoor adventures.","organic, sustainable, sportswear, clothing",114.91
358,Purifying Face Mask,Beauty,Luxury skincare: Purifying Face Mask packed with actives for daily hydration.,"organic, cruelty-free, clean-beauty, glow, beauty",58.04
359,Minimalist Candle,Home Decor,"Transform your room with this Minimalist Candle, perfect for living room aesthetics.","interior-design, home-decor, aesthetic, boho, artisan",52.9
360,RGB Monitor,Gaming,Professional-grade RGB Monitor built for customizable RGB lighting and marathon sessions.,"rgb, esports, fps, pc-gaming, controller, mechanical, gaming",326.66
361,Pro Tablet,Electronics,High-performance Pro Tablet with advanced noise-cancellation and 40-hour battery life.,"usb-c, streaming, portable, electronics",224.98
362,Essential Compendium,Books,From basics to mastery: the Essential Compendium for anyone interested in philosophy.,"nonfiction, reference, study, learning, book, education, books",49.24
363,Resistance Balance Board,Fitness,"Durable and versatile, the Resistance Balance Board supports HIIT routines training regimens.","gym, home-gym, workout, health, fitness",221.49
364,Insulated Knife Set,Kitchen,Insulated Knife Set built for batch cooking — perfect for everyday cooking and entertaining.,"baking, kitchen, cooking",125.31
365,Slim-Fit Hoodie,Clothing,Slim-Fit Hoodie crafted for yoga sessions with premium sustainable materials.,"activewear, comfort, eco-friendly, fashion, apparel, clothing",55.95
366,Nourishing Face Mask,Beauty,Dermatologist-tested Nourishing Face Mask for anti-aging benefits and long-lasting radiance.,"clean-beauty, moisturizing, spf, skincare, glow, beauty",98.23
367,Rustic Candle,Home Decor,"Transform your room with this Rustic Candle, perfect for bedroom aesthetics.","cozy, artisan, home-decor, interior-design, aesthetic",125.61
368,Optical GPU Cooler,Gaming,Professional-grade Optical GPU Cooler built for anti-ghosting and marathon sessions.,"mechanical, peripheral, esports, streamer, pc-gaming, gaming",351.47
369,Smart Microphone,Electronics,High-performance Smart Microphone with advanced noise-cancellation and touch controls.,"portable, noise-cancelling, usb-c, streaming, gadget, bluetooth, electronics",88.98
370,Advanced Workbook,Books,"Packed with insights, this Advanced Workbook explores software engineering in depth.","fiction, study, knowledge, reference, books",11.5
371,Resistance Resistance Bands,Fitness,Elevate your workout with this Resistance Resistance Bands optimized for strength building.,"workout, exercise, strength, training, recovery, fitness",130.61
372,Stainless Steel Cutting Board,Kitchen,Stainless Steel Cutting Board built for batch cooking — perfect for everyday cooking and entertaining.,"nonstick, eco-friendly, healthy-eating, baking, chef, kitchen",93.39
373,Organic Sweatshirt,Clothing,Performance-ready Organic Sweatshirt built for outdoor adventures in any weather.,"fashion, comfort, activewear, organic, sportswear, sustainable, clothing",76.04
374,Brightening Face Mask,Beauty,Luxury skincare: Brightening Face Mask packed with actives for anti-aging benefits.,"spf, anti-aging, skincare, glow, beauty",21.06
375,Industrial Bookshelf,Home Decor,Industrial Bookshelf that adds character and warmth to any minimalist space.,"boho, minimalist, home-decor",192.9
376,Pro Mechanical Keyboard,Gaming,Pro Mechanical Keyboard engineered for competitive gaming with surround sound.,"streamer, pc-gaming, mmorpg, controller, gaming",245.09
377,4K Charger,Electronics,Experience crystal-clear audio with this 4K Charger featuring USB-C connectivity.,"tech, gadget, productivity, smart, audio, streaming, electronics",220.26
378,Beginner's Primer,Books,This bestselling Beginner's Primer on software engineering has transformed how professionals learn.,"bestseller, book, knowledge, study, books",46.54
379,Adjustable Dumbbells,Fitness,Build strength at home with this Adjustable Dumbbells — perfect for yoga practice.,"training, exercise, fitness",96.73
380,Stainless Steel Food Processor,Kitchen,Professional-grade Stainless Steel Food Processor engineered for quick sautéing and easy cleanup.,"meal-prep, food, baking, healthy-eating, appliance, cooking, kitchen",176.41
381,Recycled T-Shirt,Clothing,Recycled T-Shirt crafted for running with premium sustainable materials.,"eco-friendly, apparel, style, organic, clothing",149.16
382,Soothing Sunscreen,Beauty,Dermatologist-tested Soothing Sunscreen for overnight repair and long-lasting radiance.,"glow, moisturizing, beauty, clean-beauty",38.34
383,Boho Wall Art,Home Decor,Elegant Boho Wall Art designed to complement home office interior styles.,"artisan, rustic, aesthetic, modern, cozy, interior-design, home-decor",104.24
384,Wireless Mechanical Keyboard,Gaming,Professional-grade Wireless Mechanical Keyboard built for tactile switches and marathon sessions.,"controller, esports, pc-gaming, rgb, mechanical, gaming",423.02
385,Portable Mouse,Electronics,High-performance Portable Mouse with advanced noise-cancellation and multi-device pairing.,"wireless, smart, noise-cancelling, audio, ergonomic, electronics",143.94
386,Beginner's Handbook,Books,"Packed with insights, this Beginner's Handbook explores history in depth.","study, learning, knowledge, fiction, books",22.94
387,Premium Ab Wheel,Fitness,"Durable and versatile, the Premium Ab Wheel supports core training training regimens.","training, exercise, cardio, fitness, strength",299.14
388,Non-Stick Knife Set,Kitchen,The Non-Stick Knife Set every kitchen needs for baking.,"cooking, meal-prep, eco-friendly, kitchen, nonstick, chef",260.79
389,Thermal Vest,Clothing,Thermal Vest crafted for weekend lounging with premium sustainable materials.,"comfort, clothing, eco-friendly",122.4
390,Hydrating Lip Balm,Beauty,Dermatologist-tested Hydrating Lip Balm for anti-aging benefits and long-lasting radiance.,"clean-beauty, vegan, organic, beauty, anti-aging, skincare",63.26
391,Boho Mirror,Home Decor,Boho Mirror that adds character and warmth to any home office space.,"interior-design, artisan, boho, home-decor",29.82
392,Ergonomic Monitor,Gaming,The Ergonomic Monitor trusted by esports pros — delivers anti-ghosting.,"esports, peripheral, rgb, controller, pc-gaming, gaming",464.42
393,Ultra Webcam,Electronics,High-performance Ultra Webcam with advanced noise-cancellation and fast charging.,"tech, smart, ergonomic, audio, streaming, electronics",230.55
394,Comprehensive Encyclopedia,Books,A Comprehensive Encyclopedia covering creative writing with real-world examples and exercises.,"learning, education, knowledge, reference, books",18.81
395,Premium Dumbbells,Fitness,"Durable and versatile, the Premium Dumbbells supports full-body workouts training regimens.","health, cardio, exercise, strength, home-gym, fitness",244.46
396,Insulated Pan,Kitchen,Insulated Pan built for slow cooking — perfect for everyday cooking and entertaining.,"food, kitchen, eco-friendly, baking",52.1
397,Organic Polo,Clothing,Performance-ready Organic Polo built for travel in any weather.,"fashion, style, sportswear, clothing",135.75
398,Vegan Sunscreen,Beauty,Dermatologist-tested Vegan Sunscreen for overnight repair and long-lasting radiance.,"moisturizing, vegan, cruelty-free, glow, skincare, clean-beauty, beauty",117.28
399,Rustic Bookshelf,Home Decor,Rustic Bookshelf that adds character and warmth to any home office space.,"rustic, minimalist, interior-design, home-decor",215.13
400,Optical Monitor,Gaming,Professional-grade Optical Monitor built for tactile switches and marathon sessions.,"fps, rgb, peripheral, pc-gaming, gaming",582.82
401,4K USB Hub,Electronics,Experience crystal-clear audio with this 4K USB Hub featuring USB-C connectivity.,"smart, streaming, gadget, tech, wireless, electronics",220.52
402,Comprehensive Workbook,Books,"Packed with insights, this Comprehensive Workbook explores history in depth.","knowledge, study, education, books",53.7
403,Adjustable Foam Roller,Fitness,"Adjustable Foam Roller designed for home and gym use, featuring cardio sessions.","workout, strength, health, gym, fitness",199.97
404,Multi-Function Air Fryer,Kitchen,The Multi-Function Air Fryer every kitchen needs for pressure cooking.,"nonstick, healthy-eating, baking, kitchen, appliance",138.63
405,Breathable Vest,Clothing,Performance-ready Breathable Vest built for everyday comfort in any weather.,"style, comfort, fashion, eco-friendly, activewear, clothing",31.34
406,Purifying Face Wash,Beauty,Purifying Face Wash formulated with natural ingredients for sensitive skin.,"anti-aging, clean-beauty, vegan, organic, cruelty-free, beauty",55.62
407,Minimalist Picture Frame,Home Decor,Minimalist Picture Frame that adds character and warmth to any Scandinavian space.,"boho, cozy, modern, home-decor",111.74
408,Pro Gaming Chair,Gaming,The Pro Gaming Chair trusted by esports pros — delivers 60Hz+ refresh rate.,"fps, rgb, pc-gaming, esports, peripheral, streamer, gaming",303.43
409,Ultra USB Hub,Electronics,Experience crystal-clear audio with this Ultra USB Hub featuring multi-device pairing.,"bluetooth, wireless, audio, tech, electronics",231.62
410,Essential Manual,Books,A Essential Manual covering psychology with real-world examples and exercises.,"book, bestseller, reference, knowledge, education, books",14.61
411,Professional Exercise Bike,Fitness,Build strength at home with this Professional Exercise Bike — perfect for flexibility exercises.,"health, fitness, gym, yoga, strength",206.38
412,BPA-Free Cutting Board,Kitchen,The BPA-Free Cutting Board every kitchen needs for smoothie making.,"baking, meal-prep, nonstick, kitchen",116.81
413,Windproof Hoodie,Clothing,Performance-ready Windproof Hoodie built for athletic performance in any weather.,"organic, apparel, style, comfort, sustainable, clothing",118.17
414,Purifying Serum,Beauty,Luxury skincare: Purifying Serum packed with actives for UV protection.,"cruelty-free, organic, beauty, glow",93.87
415,Coastal Throw Pillow,Home Decor,Elegant Coastal Throw Pillow designed to complement mid-century modern interior styles.,"rustic, artisan, interior-design, minimalist, aesthetic, modern, home-decor",19.11
416,Ultra-Light Headset,Gaming,Dominate the game with this Ultra-Light Headset featuring ultra-low latency.,"controller, rgb, mmorpg, esports, gaming",181.78
417,Portable Monitor,Electronics,Experience crystal-clear audio with this Portable Monitor featuring 40-hour battery life.,"audio, usb-c, smart, ergonomic, tech, electronics",69.15
418,Illustrated Atlas,Books,This bestselling Illustrated Atlas on philosophy has transformed how professionals learn.,"bestseller, knowledge, learning, books",15.82
419,Heavy-Duty Dumbbells,Fitness,"Durable and versatile, the Heavy-Duty Dumbbells supports yoga practice training regimens.","strength, workout, yoga, training, gym, fitness",217.31
420,Non-Stick Toaster,Kitchen,Professional-grade Non-Stick Toaster engineered for baking and easy cleanup.,"food, nonstick, kitchen, meal-prep, eco-friendly",324.46
421,Recycled Vest,Clothing,"Stay comfortable all day in this Recycled Vest, designed for running.","fashion, apparel, comfort, activewear, organic, eco-friendly, clothing",86.84
422,Brightening Face Wash,Beauty,Luxury skincare: Brightening Face Wash packed with actives for daily hydration.,"anti-aging, cruelty-free, skincare, beauty",22.22
423,Industrial Table Lamp,Home Decor,Hand-crafted Industrial Table Lamp inspired by bedroom design traditions.,"modern, boho, aesthetic, home-decor",62.05
424,Optical Stream Deck,Gaming,Dominate the game with this Optical Stream Deck featuring surround sound.,"esports, pc-gaming, fps, mechanical, streamer, peripheral, gaming",386.3
425,Ultra Headphones,Electronics,High-performance Ultra Headphones with advanced noise-cancellation and fast charging.,"usb-c, noise-cancelling, wireless, electronics",486.58
426,Comprehensive Manual,Books,This bestselling Comprehensive Manual on creative writing has transformed how professionals learn.,"reference, learning, education, reading, book, bestseller, books",49.84
427,Resistance Foam Roller,Fitness,Elevate your workout with this Resistance Foam Roller optimized for core training.,"health, gym, home-gym, recovery, fitness",163.75
428,Multi-Function Knife Set,Kitchen,Professional-grade Multi-Function Knife Set engineered for baking and easy cleanup.,"food, chef, baking, kitchen",161.09
429,Slim-Fit Jacket,Clothing,Performance-ready Slim-Fit Jacket built for yoga sessions in any weather.,"comfort, fashion, activewear, organic, style, clothing",70.49
430,Soothing Moisturizer,Beauty,Soothing Moisturizer formulated with natural ingredients for UV protection.,"cruelty-free, anti-aging, moisturizing, glow, organic, beauty",100.5
431,Scandinavian Mirror,Home Decor,Scandinavian Mirror that adds character and warmth to any home office space.,"boho, rustic, modern, cozy, home-decor, artisan",52.08
432,Wireless GPU Cooler,Gaming,Professional-grade Wireless GPU Cooler built for hot-swap switches and marathon sessions.,"controller, rgb, fps, esports, mmorpg, pc-gaming, gaming",500.38
433,Compact Keyboard,Electronics,Next-generation Compact Keyboard powered by AI with fast charging.,"tech, smart, noise-cancelling, gadget, wireless, electronics",475.08
434,Illustrated Guide,Books,From basics to mastery: the Illustrated Guide for anyone interested in creative writing.,"study, knowledge, reference, education, books",39.14
435,Heavy-Duty Kettlebell,Fitness,Build strength at home with this Heavy-Duty Kettlebell — perfect for core training.,"training, gym, strength, fitness, workout, home-gym",294.67
436,Insulated Dutch Oven,Kitchen,Insulated Dutch Oven built for deep frying — perfect for everyday cooking and entertaining.,"kitchen, eco-friendly, meal-prep, nonstick, healthy-eating",318.61
437,Moisture-Wicking Jacket,Clothing,Versatile Moisture-Wicking Jacket that transitions seamlessly from athletic performance to casual wear.,"clothing, fashion, organic, eco-friendly, activewear",53.16
438,SPF-Protected Lip Balm,Beauty,SPF-Protected Lip Balm formulated with natural ingredients for anti-aging benefits.,"vegan, anti-aging, clean-beauty, glow, beauty",80.83
439,Coastal Mirror,Home Decor,Elegant Coastal Mirror designed to complement coastal interior styles.,"aesthetic, handmade, interior-design, cozy, boho, home-decor",205.57
440,Optical Headset,Gaming,The Optical Headset trusted by esports pros — delivers tactile switches.,"esports, streamer, fps, gaming",205.51
441,Smart Charger,Electronics,High-performance Smart Charger with advanced noise-cancellation and 40-hour battery life.,"bluetooth, wireless, tech, usb-c, productivity, audio, electronics",214.43
442,Definitive Atlas,Books,A Definitive Atlas covering philosophy with real-world examples and exercises.,"knowledge, education, study, reference, book, books",15.81
443,Professional Kettlebell,Fitness,"Professional Kettlebell designed for home and gym use, featuring strength building.","training, cardio, yoga, gym, health, fitness",192.46
444,Ceramic Instant Pot,Kitchen,Ceramic Instant Pot built for smoothie making — perfect for everyday cooking and entertaining.,"baking, chef, eco-friendly, food, kitchen",160.63
445,Recycled Shorts,Clothing,Performance-ready Recycled Shorts built for athletic performance in any weather.,"clothing, sportswear, fashion, eco-friendly",63.97
446,Soothing Lip Balm,Beauty,Achieve glowing skin with this Soothing Lip Balm designed for UV protection.,"beauty, spf, vegan, moisturizing, organic",58.52
447,Rustic Rug,Home Decor,"Transform your room with this Rustic Rug, perfect for minimalist aesthetics.","boho, rustic, interior-design, home-decor, cozy, minimalist",106.64
448,Wireless Stream Deck,Gaming,Dominate the game with this Wireless Stream Deck featuring surround sound.,"peripheral, pc-gaming, fps, gaming",324.76
449,Wireless Earbuds,Electronics,Experience crystal-clear audio with this Wireless Earbuds featuring low-latency streaming.,"audio, portable, noise-cancelling, tech, electronics",362.88
