Product_ID,Product_Name,Category,Description,Tags,Price
1,Smart Headphones,Electronics,Experience crystal-clear audio with this Smart Headphones featuring HD video support.,"tech, bluetooth, productivity, noise-cancelling, electronics",303.43
2,Essential Guide,Books,This bestselling Essential Guide on data science has transformed how professionals learn.,"reading, book, reference, fiction, books",42.48
3,Compact Kettlebell,Fitness,Elevate your workout with this Compact Kettlebell optimized for flexibility exercises.,"fitness, workout, cardio, strength, recovery",59.3
4,Ceramic Pot,Kitchen,"Cook smarter with this Ceramic Pot, ideal for slow cooking.","meal-prep, appliance, baking, kitchen",284.99
5,Breathable Sweatshirt,Clothing,Performance-ready Breathable Sweatshirt built for everyday comfort in any weather.,"sportswear, sustainable, comfort, clothing",95.05
6,Organic Moisturizer,Beauty,Achieve glowing skin with this Organic Moisturizer designed for sensitive skin.,"organic, skincare, anti-aging, beauty",39.85
7,Vintage Candle,Home Decor,"Transform your room with this Vintage Candle, perfect for mid-century modern aesthetics.","rustic, interior-design, minimalist, aesthetic, home-decor",186.33
8,Wireless Capture Card,Gaming,Professional-grade Wireless Capture Card built for hot-swap switches and marathon sessions.,"mmorpg, gaming, mechanical, streamer",43.45
9,Portable Charger,Electronics,High-performance Portable Charger with advanced noise-cancellation and HD video support.,"streaming, audio, gadget, usb-c, electronics",209.89
10,Comprehensive Compendium,Books,From basics to mastery: the Comprehensive Compendium for anyone interested in history.,"reference, reading, nonfiction, fiction, books",39.22
11,Heavy-Duty Yoga Mat,Fitness,"Heavy-Duty Yoga Mat designed for home and gym use, featuring recovery sessions.","cardio, recovery, yoga, exercise, home-gym, fitness",208.87
12,Stainless Steel Dutch Oven,Kitchen,The Stainless Steel Dutch Oven every kitchen needs for batch cooking.,"cooking, baking, healthy-eating, appliance, chef, kitchen",14.08
13,Thermal Sweatshirt,Clothing,Thermal Sweatshirt crafted for outdoor adventures with premium sustainable materials.,"sportswear, activewear, apparel, style, fashion, clothing",90.11
14,Nourishing Moisturizer,Beauty,Luxury skincare: Nourishing Moisturizer packed with actives for brightening.,"skincare, moisturizing, spf, beauty",35.57
15,Rustic Planter,Home Decor,Rustic Planter that adds character and warmth to any bedroom space.,"interior-design, cozy, minimalist, aesthetic, modern, boho, home-decor",237.5
16,Wireless Mouse Pad,Gaming,Dominate the game with this Wireless Mouse Pad featuring hot-swap switches.,"fps, streamer, mmorpg, mechanical, gaming",542.27
17,Bluetooth Speaker,Electronics,Experience crystal-clear audio with this Bluetooth Speaker featuring USB-C connectivity.,"audio, wireless, streaming, electronics",285.87
18,Advanced Encyclopedia,Books,A Advanced Encyclopedia covering machine learning with real-world examples and exercises.,"reference, learning, book, books",52.97
19,Professional Balance Board,Fitness,"Durable and versatile, the Professional Balance Board supports flexibility exercises training regimens.","health, home-gym, workout, yoga, gym, training, fitness",245.13
20,Multi-Function Pot,Kitchen,"Cook smarter with this Multi-Function Pot, ideal for slow cooking.","healthy-eating, appliance, eco-friendly, nonstick, meal-prep, kitchen",31.25
21,Relaxed T-Shirt,Clothing,Versatile Relaxed T-Shirt that transitions seamlessly from office wear to casual wear.,"activewear, eco-friendly, sportswear, clothing",89.71
22,Vegan Lip Balm,Beauty,Achieve glowing skin with this Vegan Lip Balm designed for oil control.,"organic, skincare, cruelty-free, anti-aging, spf, beauty",14.61
23,Artisan Wall Art,Home Decor,Hand-crafted Artisan Wall Art inspired by bedroom design traditions.,"handmade, artisan, cozy, interior-design, home-decor",218.18
24,Mechanical Headset,Gaming,Mechanical Headset engineered for competitive gaming with hot-swap switches.,"fps, controller, pc-gaming, mechanical, mmorpg, peripheral, gaming",405.57
25,Bluetooth Monitor,Electronics,"Engineered for professionals, this Bluetooth Monitor delivers USB-C connectivity and seamless connectivity.","wireless, streaming, productivity, ergonomic, electronics",379.02
26,Advanced Handbook,Books,"Packed with insights, this Advanced Handbook explores philosophy in depth.","study, reference, book, books",40.96
27,Resistance Exercise Bike,Fitness,"Durable and versatile, the Resistance Exercise Bike supports strength building training regimens.","training, strength, health, exercise, fitness",127.79
28,Cast Iron Instant Pot,Kitchen,Cast Iron Instant Pot built for pressure cooking — perfect for everyday cooking and entertaining.,"eco-friendly, cooking, nonstick, kitchen",194.17
29,Recycled Leggings,Clothing,Versatile Recycled Leggings that transitions seamlessly from outdoor adventures to casual wear.,"activewear, comfort, sustainable, clothing",40.5
30,Nourishing Eye Cream,Beauty,Achieve glowing skin with this Nourishing Eye Cream designed for daily hydration.,"vegan, spf, skincare, beauty",107.75
31,Artisan Candle,Home Decor,"Transform your room with this Artisan Candle, perfect for bohemian aesthetics.","modern, boho, rustic, artisan, home-decor",129.79
32,Mechanical Mechanical Keyboard,Gaming,Professional-grade Mechanical Mechanical Keyboard built for hot-swap switches and marathon sessions.,"gaming, mmorpg, rgb",391.33
33,Compact Monitor,Electronics,Next-generation Compact Monitor powered by AI with touch controls.,"bluetooth, ergonomic, tech, electronics",281.87
34,Definitive Anthology,Books,This bestselling Definitive Anthology on astronomy has transformed how professionals learn.,"education, book, nonfiction, study, reading, bestseller, books",20.49
35,Heavy-Duty Resistance Bands,Fitness,Elevate your workout with this Heavy-Duty Resistance Bands optimized for strength building.,"health, workout, recovery, cardio, fitness",22.05
36,Ceramic Knife Set,Kitchen,The Ceramic Knife Set every kitchen needs for baking.,"cooking, healthy-eating, kitchen, nonstick",171.61
37,Organic Vest,Clothing,Versatile Organic Vest that transitions seamlessly from running to casual wear.,"activewear, clothing, eco-friendly, style",62.66
38,Organic Eye Cream,Beauty,Luxury skincare: Organic Eye Cream packed with actives for brightening.,"beauty, skincare, spf, clean-beauty, cruelty-free",115.83
39,Modern Wall Art,Home Decor,Elegant Modern Wall Art designed to complement bedroom interior styles.,"modern, handmade, interior-design, boho, rustic, home-decor",59.66
40,Mechanical Monitor,Gaming,Dominate the game with this Mechanical Monitor featuring ultra-low latency.,"streamer, esports, mmorpg, fps, rgb, gaming",406.44
41,Smart USB Hub,Electronics,"Engineered for professionals, this Smart USB Hub delivers HD video support and seamless connectivity.","audio, smart, portable, productivity, tech, bluetooth, electronics",221.8
42,Beginner's Manual,Books,From basics to mastery: the Beginner's Manual for anyone interested in astronomy.,"reading, book, nonfiction, education, learning, reference, books",49.28
43,Compact Foam Roller,Fitness,Elevate your workout with this Compact Foam Roller optimized for yoga practice.,"training, health, home-gym, yoga, cardio, strength, fitness",63.35
44,Stainless Steel Coffee Maker,Kitchen,The Stainless Steel Coffee Maker every kitchen needs for batch cooking.,"chef, baking, appliance, kitchen",284.8
45,Moisture-Wicking T-Shirt,Clothing,"Stay comfortable all day in this Moisture-Wicking T-Shirt, designed for athletic performance.","eco-friendly, fashion, style, activewear, comfort, sustainable, clothing",45.27
46,Soothing Body Lotion,Beauty,Dermatologist-tested Soothing Body Lotion for pore minimizing and long-lasting radiance.,"beauty, skincare, anti-aging, clean-beauty",28.51
47,Artisan Mirror,Home Decor,Hand-crafted Artisan Mirror inspired by living room design traditions.,"artisan, minimalist, aesthetic, home-decor",171.87
48,Pro Capture Card,Gaming,The Pro Capture Card trusted by esports pros — delivers hot-swap switches.,"controller, pc-gaming, fps, streamer, gaming",167.15
49,Compact Microphone,Electronics,Experience crystal-clear audio with this Compact Microphone featuring touch controls.,"usb-c, bluetooth, portable, gadget, streaming, electronics",181.2
50,Complete Atlas,Books,"Packed with insights, this Complete Atlas explores economics in depth.","reference, bestseller, reading, books",55.23
51,Compact Dumbbells,Fitness,Elevate your workout with this Compact Dumbbells optimized for recovery sessions.,"strength, exercise, cardio, fitness",258.22
52,BPA-Free Toaster,Kitchen,Professional-grade BPA-Free Toaster engineered for batch cooking and easy cleanup.,"chef, baking, healthy-eating, appliance, kitchen, eco-friendly",126.27
53,Windproof Joggers,Clothing,"Stay comfortable all day in this Windproof Joggers, designed for weekend lounging.","organic, clothing, fashion",103.55
54,Vegan Body Lotion,Beauty,Vegan Body Lotion formulated with natural ingredients for oil control.,"anti-aging, moisturizing, organic, cruelty-free, vegan, beauty",46.45
55,Industrial Picture Frame,Home Decor,"Transform your room with this Industrial Picture Frame, perfect for coastal aesthetics.","artisan, home-decor, cozy",249.97
56,Pro Controller,Gaming,Pro Controller engineered for competitive gaming with customizable RGB lighting.,"mechanical, pc-gaming, gaming",382.26
57,Pro Monitor,Electronics,High-performance Pro Monitor with advanced noise-cancellation and touch controls.,"usb-c, portable, audio, tech, electronics",310.82
58,Comprehensive Handbook,Books,From basics to mastery: the Comprehensive Handbook for anyone interested in history.,"study, book, nonfiction, books",38.78
59,Resistance Kettlebell,Fitness,"Resistance Kettlebell designed for home and gym use, featuring flexibility exercises.","gym, exercise, training, fitness",113.94
60,BPA-Free Dutch Oven,Kitchen,BPA-Free Dutch Oven built for pressure cooking — perfect for everyday cooking and entertaining.,"kitchen, healthy-eating, eco-friendly, appliance, chef",336.78
61,Breathable Joggers,Clothing,"Stay comfortable all day in this Breathable Joggers, designed for office wear.","eco-friendly, sportswear, style, activewear, organic, clothing",127.34
62,Anti-Aging Toner,Beauty,Anti-Aging Toner formulated with natural ingredients for sensitive skin.,"cruelty-free, organic, glow, spf, anti-aging, beauty",83.16
63,Vintage Wall Art,Home Decor,"Transform your room with this Vintage Wall Art, perfect for minimalist aesthetics.","artisan, boho, modern, handmade, home-decor",75.7
64,Ultra-Light GPU Cooler,Gaming,Ultra-Light GPU Cooler engineered for competitive gaming with surround sound.,"esports, mechanical, streamer, peripheral, gaming",344.22
65,Pro USB Hub,Electronics,Next-generation Pro USB Hub powered by AI with touch controls.,"wireless, bluetooth, portable, gadget, smart, audio, electronics",136.78
66,Comprehensive Journal,Books,"Packed with insights, this Comprehensive Journal explores software engineering in depth.","bestseller, reading, fiction, education, knowledge, books",32.68
67,Adjustable Jump Rope,Fitness,"Adjustable Jump Rope designed for home and gym use, featuring flexibility exercises.","strength, gym, home-gym, workout, fitness",69.58
68,Insulated Coffee Maker,Kitchen,The Insulated Coffee Maker every kitchen needs for batch cooking.,"chef, baking, appliance, kitchen",134.61
69,Thermal T-Shirt,Clothing,Versatile Thermal T-Shirt that transitions seamlessly from outdoor adventures to casual wear.,"clothing, sportswear, sustainable",110.65
70,Anti-Aging Body Lotion,Beauty,Anti-Aging Body Lotion formulated with natural ingredients for anti-aging benefits.,"cruelty-free, skincare, beauty, clean-beauty, anti-aging, spf",114.34
71,Boho Vase,Home Decor,Elegant Boho Vase designed to complement bedroom interior styles.,"cozy, handmade, artisan, boho, home-decor",84.87
72,Wired Mouse Pad,Gaming,Wired Mouse Pad engineered for competitive gaming with ultra-low latency.,"mechanical, fps, esports, controller, gaming",162.91
73,AI-Powered Speaker,Electronics,High-performance AI-Powered Speaker with advanced noise-cancellation and multi-device pairing.,"usb-c, streaming, ergonomic, portable, wireless, bluetooth, electronics",158.28
74,Complete Compendium,Books,This bestselling Complete Compendium on data science has transformed how professionals learn.,"study, reference, bestseller, book, nonfiction, books",21.23
75,Heavy-Duty Jump Rope,Fitness,"Heavy-Duty Jump Rope designed for home and gym use, featuring cardio sessions.","workout, exercise, recovery, fitness",140.15
76,Non-Stick Pot,Kitchen,Non-Stick Pot built for baking — perfect for everyday cooking and entertaining.,"appliance, kitchen, food, chef, baking",232.55
77,Thermal Joggers,Clothing,Performance-ready Thermal Joggers built for office wear in any weather.,"style, comfort, organic, clothing",63.32
78,Organic Face Wash,Beauty,Luxury skincare: Organic Face Wash packed with actives for brightening.,"spf, anti-aging, beauty, organic, cruelty-free, vegan",37.01
79,Boho Table Lamp,Home Decor,Boho Table Lamp that adds character and warmth to any eclectic space.,"handmade, home-decor, boho, rustic, minimalist, aesthetic",192.75
80,Optical Gaming Mouse,Gaming,Professional-grade Optical Gaming Mouse built for 6-axis tracking and marathon sessions.,"fps, controller, peripheral, gaming",41.59
81,Smart Earbuds,Electronics,Experience crystal-clear audio with this Smart Earbuds featuring fast charging.,"ergonomic, portable, productivity, noise-cancelling, smart, usb-c, electronics",251.59
82,Beginner's Encyclopedia,Books,This bestselling Beginner's Encyclopedia on economics has transformed how professionals learn.,"reference, reading, education, bestseller, book, knowledge, books",48.62
83,Foldable Kettlebell,Fitness,"Durable and versatile, the Foldable Kettlebell supports strength building training regimens.","exercise, training, yoga, fitness",261.59
84,Insulated Toaster,Kitchen,The Insulated Toaster every kitchen needs for precision slicing.,"nonstick, appliance, healthy-eating, chef, food, kitchen",306.05
85,Organic Track Pants,Clothing,"Stay comfortable all day in this Organic Track Pants, designed for office wear.","clothing, comfort, style, sportswear, activewear, organic",148.48
86,Nourishing Lip Balm,Beauty,Luxury skincare: Nourishing Lip Balm packed with actives for brightening.,"glow, skincare, organic, beauty",79.05
87,Modern Vase,Home Decor,Elegant Modern Vase designed to complement bedroom interior styles.,"interior-design, artisan, minimalist, home-decor",178.08
88,Mechanical Gaming Mouse,Gaming,Mechanical Gaming Mouse engineered for competitive gaming with anti-ghosting.,"mmorpg, pc-gaming, streamer, esports, controller, gaming",330.41
89,Ultra Monitor,Electronics,High-performance Ultra Monitor with advanced noise-cancellation and multi-device pairing.,"streaming, noise-cancelling, gadget, usb-c, tech, bluetooth, electronics",241.34
90,Complete Primer,Books,"Packed with insights, this Complete Primer explores creative writing in depth.","reference, bestseller, knowledge, book, learning, books",29.06
91,Adjustable Exercise Bike,Fitness,"Durable and versatile, the Adjustable Exercise Bike supports HIIT routines training regimens.","training, cardio, exercise, fitness",17.3
92,Non-Stick Food Processor,Kitchen,The Non-Stick Food Processor every kitchen needs for precision slicing.,"appliance, meal-prep, chef, nonstick, kitchen",77.06
93,Thermal Shorts,Clothing,"Stay comfortable all day in this Thermal Shorts, designed for office wear.","apparel, sportswear, comfort, sustainable, clothing",85.22
94,Anti-Aging Face Wash,Beauty,Luxury skincare: Anti-Aging Face Wash packed with actives for UV protection.,"moisturizing, skincare, cruelty-free, beauty, clean-beauty",92.7
95,Rustic Table Lamp,Home Decor,"Transform your room with this Rustic Table Lamp, perfect for eclectic aesthetics.","handmade, home-decor, rustic",141.08
96,Optical Gaming Chair,Gaming,The Optical Gaming Chair trusted by esports pros — delivers surround sound.,"esports, mechanical, controller, gaming, fps",533.43
97,AI-Powered Webcam,Electronics,High-performance AI-Powered Webcam with advanced noise-cancellation and USB-C connectivity.,"ergonomic, portable, smart, bluetooth, tech, wireless, electronics",474.2
98,Comprehensive Atlas,Books,This bestselling Comprehensive Atlas on biohacking has transformed how professionals learn.,"learning, knowledge, bestseller, education, book, reading, books",20.85
99,Resistance Pull-Up Bar,Fitness,"Resistance Pull-Up Bar designed for home and gym use, featuring strength building.","home-gym, strength, fitness, cardio, workout",69.09
100,Stainless Steel Instant Pot,Kitchen,Professional-grade Stainless Steel Instant Pot engineered for slow cooking and easy cleanup.,"kitchen, meal-prep, chef",346.22
101,Organic Hoodie,Clothing,"Stay comfortable all day in this Organic Hoodie, designed for travel.","comfort, apparel, clothing, sportswear",131.58
102,Vegan Face Wash,Beauty,Dermatologist-tested Vegan Face Wash for UV protection and long-lasting radiance.,"beauty, vegan, glow",48.75
103,Boho Throw Pillow,Home Decor,Elegant Boho Throw Pillow designed to complement minimalist interior styles.,"cozy, interior-design, artisan, rustic, aesthetic, home-decor",237.16
104,Mechanical Stream Deck,Gaming,The Mechanical Stream Deck trusted by esports pros — delivers surround sound.,"gaming, controller, streamer",270.1
105,Compact Tablet,Electronics,Next-generation Compact Tablet powered by AI with low-latency streaming.,"usb-c, productivity, streaming, smart, bluetooth, electronics",400.68
106,Essential Atlas,Books,"Packed with insights, this Essential Atlas explores philosophy in depth.","reference, bestseller, fiction, reading, study, knowledge, books",30.79
107,Professional Foam Roller,Fitness,"Durable and versatile, the Professional Foam Roller supports recovery sessions training regimens.","strength, workout, yoga, gym, fitness",252.04
108,Stainless Steel Knife Set,Kitchen,The Stainless Steel Knife Set every kitchen needs for slow cooking.,"nonstick, kitchen, meal-prep, eco-friendly",54.18
109,Stretch Polo,Clothing,Versatile Stretch Polo that transitions seamlessly from athletic performance to casual wear.,"comfort, fashion, activewear, sportswear, eco-friendly, clothing",82.67
110,Organic Toner,Beauty,Organic Toner formulated with natural ingredients for brightening.,"glow, organic, anti-aging, cruelty-free, spf, beauty",117.16
111,Scandinavian Planter,Home Decor,Scandinavian Planter that adds character and warmth to any coastal space.,"home-decor, interior-design, boho, artisan",113.65
112,Pro Headset,Gaming,Professional-grade Pro Headset built for anti-ghosting and marathon sessions.,"pc-gaming, esports, gaming, peripheral, streamer",458.79
113,Wireless Laptop Stand,Electronics,"Engineered for professionals, this Wireless Laptop Stand delivers fast charging and seamless connectivity.","noise-cancelling, smart, usb-c, streaming, ergonomic, tech, electronics",123.46
114,Beginner's Journal,Books,A Beginner's Journal covering machine learning with real-world examples and exercises.,"nonfiction, reference, education, bestseller, books",22.77
115,Adjustable Resistance Bands,Fitness,Elevate your workout with this Adjustable Resistance Bands optimized for full-body workouts.,"workout, training, cardio, health, exercise, home-gym, fitness",252.5
116,Insulated Cutting Board,Kitchen,"Cook smarter with this Insulated Cutting Board, ideal for slow cooking.","chef, healthy-eating, nonstick, kitchen",189.57
117,Windproof Leggings,Clothing,"Stay comfortable all day in this Windproof Leggings, designed for running.","apparel, fashion, sportswear, sustainable, organic, clothing",45.2
118,Brightening Toner,Beauty,Dermatologist-tested Brightening Toner for oil control and long-lasting radiance.,"vegan, spf, organic, beauty",28.25
119,Scandinavian Throw Pillow,Home Decor,Elegant Scandinavian Throw Pillow designed to complement home office interior styles.,"aesthetic, artisan, modern, handmade, cozy, minimalist, home-decor",50.46
120,RGB Capture Card,Gaming,Professional-grade RGB Capture Card built for 60Hz+ refresh rate and marathon sessions.,"pc-gaming, gaming, mmorpg, fps, peripheral",203.47
121,Bluetooth Headphones,Electronics,"Engineered for professionals, this Bluetooth Headphones delivers 40-hour battery life and seamless connectivity.","bluetooth, noise-cancelling, ergonomic, productivity, smart, electronics",242.09
122,Advanced Guide,Books,This bestselling Advanced Guide on economics has transformed how professionals learn.,"study, knowledge, education, book, reference, books",15.17
123,Foldable Foam Roller,Fitness,Build strength at home with this Foldable Foam Roller — perfect for core training.,"health, yoga, recovery, fitness",164.35
124,Eco-Friendly Cutting Board,Kitchen,The Eco-Friendly Cutting Board every kitchen needs for pressure cooking.,"healthy-eating, meal-prep, kitchen, appliance, nonstick, food",35.2
125,Relaxed Sweatshirt,Clothing,Versatile Relaxed Sweatshirt that transitions seamlessly from office wear to casual wear.,"eco-friendly, apparel, comfort, clothing, sustainable",106.26
126,Brightening Eye Cream,Beauty,Dermatologist-tested Brightening Eye Cream for pore minimizing and long-lasting radiance.,"spf, clean-beauty, anti-aging, beauty",80.42
127,Vintage Mirror,Home Decor,Hand-crafted Vintage Mirror inspired by Scandinavian design traditions.,"minimalist, interior-design, rustic, handmade, home-decor",200.2
128,Mechanical Gaming Chair,Gaming,The Mechanical Gaming Chair trusted by esports pros — delivers tactile switches.,"rgb, pc-gaming, peripheral, mmorpg, gaming",276.65
129,4K Webcam,Electronics,Next-generation 4K Webcam powered by AI with USB-C connectivity.,"ergonomic, usb-c, gadget, productivity, streaming, electronics",168.53
130,Definitive Compendium,Books,From basics to mastery: the Definitive Compendium for anyone interested in philosophy.,"knowledge, nonfiction, bestseller, reading, study, reference, books",58.3
131,Foldable Pull-Up Bar,Fitness,"Durable and versatile, the Foldable Pull-Up Bar supports cardio sessions training regimens.","training, yoga, strength, fitness",173.03
132,Stainless Steel Toaster,Kitchen,The Stainless Steel Toaster every kitchen needs for slow cooking.,"food, baking, eco-friendly, kitchen",318.08
133,Moisture-Wicking Polo,Clothing,"Stay comfortable all day in this Moisture-Wicking Polo, designed for everyday comfort.","comfort, clothing, organic, sportswear, activewear, sustainable",68.6
134,Soothing Serum,Beauty,Dermatologist-tested Soothing Serum for brightening and long-lasting radiance.,"moisturizing, skincare, glow, beauty",96.83
135,Scandinavian Wall Art,Home Decor,Elegant Scandinavian Wall Art designed to complement bohemian interior styles.,"artisan, aesthetic, home-decor, cozy",19.46
136,Ergonomic Headset,Gaming,Ergonomic Headset engineered for competitive gaming with hot-swap switches.,"mechanical, fps, esports, gaming, controller",266.39
137,Ultra Mouse,Electronics,High-performance Ultra Mouse with advanced noise-cancellation and ergonomic design.,"gadget, streaming, smart, tech, bluetooth, electronics",271.26
138,Complete Handbook,Books,A Complete Handbook covering psychology with real-world examples and exercises.,"knowledge, book, bestseller, education, study, reading, books",27.84
139,Foldable Ab Wheel,Fitness,Build strength at home with this Foldable Ab Wheel — perfect for yoga practice.,"gym, yoga, fitness, exercise",72.44
140,Multi-Function Pan,Kitchen,The Multi-Function Pan every kitchen needs for pressure cooking.,"nonstick, eco-friendly, baking, kitchen, meal-prep, cooking",109.41
141,Slim-Fit Shorts,Clothing,Slim-Fit Shorts crafted for yoga sessions with premium sustainable materials.,"organic, eco-friendly, style, activewear, apparel, clothing",146.57
142,Purifying Body Lotion,Beauty,Achieve glowing skin with this Purifying Body Lotion designed for brightening.,"anti-aging, skincare, glow, beauty",75.86
143,Scandinavian Rug,Home Decor,"Transform your room with this Scandinavian Rug, perfect for bohemian aesthetics.","interior-design, modern, rustic, home-decor",87.02
144,Wired Headset,Gaming,Professional-grade Wired Headset built for 60Hz+ refresh rate and marathon sessions.,"gaming, mmorpg, streamer, rgb, peripheral, pc-gaming",68.14
145,Pro Microphone,Electronics,"Engineered for professionals, this Pro Microphone delivers low-latency streaming and seamless connectivity.","streaming, wireless, ergonomic, tech, usb-c, productivity, electronics",198.56
146,Definitive Handbook,Books,This bestselling Definitive Handbook on astronomy has transformed how professionals learn.,"bestseller, fiction, nonfiction, learning, book, books",11.29
147,Heavy-Duty Ab Wheel,Fitness,"Heavy-Duty Ab Wheel designed for home and gym use, featuring recovery sessions.","exercise, yoga, health, training, strength, fitness",276.19
148,Insulated Air Fryer,Kitchen,Professional-grade Insulated Air Fryer engineered for slow cooking and easy cleanup.,"eco-friendly, food, appliance, kitchen",349.07
149,Stretch Shorts,Clothing,Versatile Stretch Shorts that transitions seamlessly from everyday comfort to casual wear.,"apparel, eco-friendly, comfort, sustainable, fashion, clothing",35.77
150,SPF-Protected Face Wash,Beauty,Luxury skincare: SPF-Protected Face Wash packed with actives for sensitive skin.,"moisturizing, clean-beauty, glow, beauty",60.87
