Product_ID,Product_Name,Category,Description,Tags,Price
450,Essential Anthology,Books,"Packed with insights, this Essential Anthology explores psychology in depth.","nonfiction, knowledge, bestseller, reference, fiction, reading, books",46.58
451,Professional Yoga Mat,Fitness,"Professional Yoga Mat designed for home and gym use, featuring strength building.","gym, training, strength, exercise, fitness, yoga",58.68
452,Cast Iron Coffee Maker,Kitchen,Professional-grade Cast Iron Coffee Maker engineered for baking and easy cleanup.,"kitchen, cooking, meal-prep, appliance, healthy-eating, chef",175.15
453,Breathable Leggings,Clothing,"Stay comfortable all day in this Breathable Leggings, designed for everyday comfort.","eco-friendly, sustainable, fashion, clothing",103.7
454,Organic Sunscreen,Beauty,Dermatologist-tested Organic Sunscreen for daily hydration and long-lasting radiance.,"clean-beauty, beauty, skincare, moisturizing, spf, cruelty-free",115.81
455,Coastal Wall Art,Home Decor,Elegant Coastal Wall Art designed to complement mid-century modern interior styles.,"handmade, home-decor, modern, boho",75.43
456,RGB Mechanical Keyboard,Gaming,Professional-grade RGB Mechanical Keyboard built for tactile switches and marathon sessions.,"rgb, fps, esports, controller, gaming",201.4
457,AI-Powered Tablet,Electronics,"Engineered for professionals, this AI-Powered Tablet delivers fast charging and seamless connectivity.","smart, bluetooth, tech, electronics",368.03
458,Complete Guide,Books,"Packed with insights, this Complete Guide explores creative writing in depth.","book, reference, bestseller, study, books",53.49
459,Resistance Dumbbells,Fitness,"Durable and versatile, the Resistance Dumbbells supports strength building training regimens.","gym, yoga, health, strength, fitness",252.26
460,BPA-Free Instant Pot,Kitchen,BPA-Free Instant Pot built for smoothie making — perfect for everyday cooking and entertaining.,"kitchen, eco-friendly, meal-prep, baking, cooking",49.39
461,Slim-Fit Track Pants,Clothing,"Stay comfortable all day in this Slim-Fit Track Pants, designed for everyday comfort.","sportswear, sustainable, comfort, activewear, clothing",82.57
462,Nourishing Toner,Beauty,Dermatologist-tested Nourishing Toner for UV protection and long-lasting radiance.,"cruelty-free, spf, moisturizing, vegan, beauty",49.93
463,Minimalist Rug,Home Decor,Minimalist Rug that adds character and warmth to any home office space.,"cozy, aesthetic, home-decor, boho",95.79
464,Mechanical Controller,Gaming,The Mechanical Controller trusted by esports pros — delivers 6-axis tracking.,"mechanical, controller, mmorpg, streamer, gaming",450.54
465,Pro Charger,Electronics,High-performance Pro Charger with advanced noise-cancellation and multi-device pairing.,"wireless, bluetooth, audio, ergonomic, noise-cancelling, electronics",88.34
466,Advanced Compendium,Books,A Advanced Compendium covering philosophy with real-world examples and exercises.,"study, learning, education, nonfiction, reference, bestseller, books",28.7
467,Adjustable Pull-Up Bar,Fitness,Elevate your workout with this Adjustable Pull-Up Bar optimized for full-body workouts.,"cardio, yoga, recovery, training, health, fitness",119.73
468,Ceramic Pan,Kitchen,Professional-grade Ceramic Pan engineered for batch cooking and easy cleanup.,"chef, meal-prep, baking, food, nonstick, kitchen",287.84
469,Thermal Jacket,Clothing,Versatile Thermal Jacket that transitions seamlessly from outdoor adventures to casual wear.,"sustainable, eco-friendly, comfort, clothing",121.8
470,Purifying Sunscreen,Beauty,Luxury skincare: Purifying Sunscreen packed with actives for overnight repair.,"skincare, moisturizing, organic, cruelty-free, clean-beauty, beauty",55.35
471,Vintage Bookshelf,Home Decor,Elegant Vintage Bookshelf designed to complement Scandinavian interior styles.,"handmade, cozy, rustic, minimalist, artisan, home-decor",148.37
472,RGB Gaming Chair,Gaming,Professional-grade RGB Gaming Chair built for 60Hz+ refresh rate and marathon sessions.,"rgb, esports, pc-gaming, gaming",43.42
473,Smart Monitor,Electronics,Next-generation Smart Monitor powered by AI with ergonomic design.,"smart, gadget, tech, electronics",437.81
474,Comprehensive Guide,Books,A Comprehensive Guide covering psychology with real-world examples and exercises.,"nonfiction, knowledge, book, study, reading, fiction, books",48.61
475,Foldable Yoga Mat,Fitness,Build strength at home with this Foldable Yoga Mat — perfect for strength building.,"training, yoga, gym, strength, fitness",188.42
476,BPA-Free Air Fryer,Kitchen,BPA-Free Air Fryer built for slow cooking — perfect for everyday cooking and entertaining.,"meal-prep, eco-friendly, baking, cooking, kitchen",64.1
477,Organic T-Shirt,Clothing,Performance-ready Organic T-Shirt built for travel in any weather.,"apparel, sustainable, comfort, style, clothing",87.7
478,SPF-Protected Sunscreen,Beauty,Achieve glowing skin with this SPF-Protected Sunscreen designed for pore minimizing.,"cruelty-free, beauty, skincare, anti-aging",63.56
479,Rustic Wall Art,Home Decor,Hand-crafted Rustic Wall Art inspired by home office design traditions.,"interior-design, minimalist, boho, aesthetic, home-decor",134.23
480,Wired GPU Cooler,Gaming,The Wired GPU Cooler trusted by esports pros — delivers surround sound.,"esports, mmorpg, rgb, gaming",179.68
481,4K Smartwatch,Electronics,"Engineered for professionals, this 4K Smartwatch delivers ergonomic design and seamless connectivity.","tech, ergonomic, audio, noise-cancelling, productivity, bluetooth, electronics",253.5
482,Comprehensive Primer,Books,A Comprehensive Primer covering biohacking with real-world examples and exercises.,"fiction, learning, book, reference, study, books",30.08
483,Foldable Balance Board,Fitness,Build strength at home with this Foldable Balance Board — perfect for full-body workouts.,"gym, exercise, home-gym, yoga, training, health, fitness",287.18
484,Insulated Pot,Kitchen,Professional-grade Insulated Pot engineered for pressure cooking and easy cleanup.,"meal-prep, healthy-eating, nonstick, kitchen",233.36
485,Windproof Polo,Clothing,Versatile Windproof Polo that transitions seamlessly from running to casual wear.,"sportswear, activewear, fashion, eco-friendly, clothing",21.18
486,Hydrating Toner,Beauty,Dermatologist-tested Hydrating Toner for anti-aging benefits and long-lasting radiance.,"anti-aging, vegan, beauty, cruelty-free, clean-beauty, organic",28.93
487,Minimalist Throw Pillow,Home Decor,"Transform your room with this Minimalist Throw Pillow, perfect for eclectic aesthetics.","minimalist, handmade, boho, home-decor, cozy, interior-design",108.2
488,Ergonomic Gaming Mouse,Gaming,Professional-grade Ergonomic Gaming Mouse built for 60Hz+ refresh rate and marathon sessions.,"pc-gaming, rgb, streamer, gaming",303.4
489,4K Mouse,Electronics,High-performance 4K Mouse with advanced noise-cancellation and multi-device pairing.,"bluetooth, productivity, tech, smart, wireless, electronics",209.01
490,Complete Journal,Books,This bestselling Complete Journal on psychology has transformed how professionals learn.,"book, reference, study, books",19.39
491,Compact Pull-Up Bar,Fitness,"Durable and versatile, the Compact Pull-Up Bar supports core training training regimens.","home-gym, gym, training, fitness",130.92
492,Ceramic Dutch Oven,Kitchen,The Ceramic Dutch Oven every kitchen needs for slow cooking.,"baking, food, chef, nonstick, kitchen",46.0
493,Recycled Sweatshirt,Clothing,Performance-ready Recycled Sweatshirt built for office wear in any weather.,"sustainable, clothing, apparel, comfort",36.42
494,Brightening Serum,Beauty,Brightening Serum formulated with natural ingredients for anti-aging benefits.,"skincare, vegan, beauty, cruelty-free",91.51
495,Artisan Vase,Home Decor,Artisan Vase that adds character and warmth to any home office space.,"minimalist, cozy, modern, home-decor, boho",131.43
496,Wireless Gaming Chair,Gaming,Professional-grade Wireless Gaming Chair built for customizable RGB lighting and marathon sessions.,"peripheral, esports, fps, rgb, gaming",302.79
497,Bluetooth Smartwatch,Electronics,Experience crystal-clear audio with this Bluetooth Smartwatch featuring touch controls.,"smart, productivity, ergonomic, tech, bluetooth, electronics",479.68
498,Complete Workbook,Books,"Packed with insights, this Complete Workbook explores software engineering in depth.","fiction, book, education, reading, books",10.02
499,Heavy-Duty Exercise Bike,Fitness,"Heavy-Duty Exercise Bike designed for home and gym use, featuring core training.","health, yoga, gym, home-gym, fitness",283.41
500,Cast Iron Blender,Kitchen,The Cast Iron Blender every kitchen needs for smoothie making.,"kitchen, appliance, meal-prep, cooking, eco-friendly",338.27
501,Relaxed Leggings,Clothing,Relaxed Leggings crafted for outdoor adventures with premium sustainable materials.,"fashion, sportswear, comfort, clothing",130.84
502,Anti-Aging Sunscreen,Beauty,Anti-Aging Sunscreen formulated with natural ingredients for pore minimizing.,"vegan, skincare, organic, beauty, glow, moisturizing",17.46
503,Rustic Throw Pillow,Home Decor,"Transform your room with this Rustic Throw Pillow, perfect for Scandinavian aesthetics.","boho, home-decor, modern",146.21
504,Wired Controller,Gaming,Dominate the game with this Wired Controller featuring 6-axis tracking.,"rgb, esports, pc-gaming, gaming",242.03
505,Wireless USB Hub,Electronics,"Engineered for professionals, this Wireless USB Hub delivers ergonomic design and seamless connectivity.","ergonomic, bluetooth, streaming, electronics",55.4
506,Advanced Anthology,Books,A Advanced Anthology covering software engineering with real-world examples and exercises.,"education, knowledge, nonfiction, books",59.3
507,Resistance Ab Wheel,Fitness,"Resistance Ab Wheel designed for home and gym use, featuring flexibility exercises.","fitness, cardio, exercise, home-gym",196.16
508,Eco-Friendly Knife Set,Kitchen,"Cook smarter with this Eco-Friendly Knife Set, ideal for pressure cooking.","nonstick, chef, cooking, kitchen",256.55
509,Moisture-Wicking Shorts,Clothing,Moisture-Wicking Shorts crafted for running with premium sustainable materials.,"style, apparel, eco-friendly, organic, clothing",61.12
510,Purifying Lip Balm,Beauty,Achieve glowing skin with this Purifying Lip Balm designed for pore minimizing.,"clean-beauty, anti-aging, moisturizing, beauty, skincare",59.92
511,Artisan Throw Pillow,Home Decor,Artisan Throw Pillow that adds character and warmth to any minimalist space.,"handmade, boho, cozy, aesthetic, artisan, home-decor",144.61
512,RGB Controller,Gaming,RGB Controller engineered for competitive gaming with 60Hz+ refresh rate.,"controller, streamer, peripheral, gaming, rgb",474.75
513,4K Headphones,Electronics,Experience crystal-clear audio with this 4K Headphones featuring ergonomic design.,"ergonomic, tech, smart, audio, noise-cancelling, gadget, electronics",130.86
514,Illustrated Primer,Books,A Illustrated Primer covering creative writing with real-world examples and exercises.,"learning, education, book, fiction, nonfiction, books",53.34
515,Compact Jump Rope,Fitness,"Durable and versatile, the Compact Jump Rope supports cardio sessions training regimens.","exercise, gym, training, fitness, health, yoga",76.93
516,Stainless Steel Pan,Kitchen,The Stainless Steel Pan every kitchen needs for precision slicing.,"healthy-eating, meal-prep, kitchen",29.81
517,Thermal Leggings,Clothing,Versatile Thermal Leggings that transitions seamlessly from everyday comfort to casual wear.,"sportswear, apparel, organic, style, activewear, clothing",38.01
518,Vegan Exfoliant,Beauty,Vegan Exfoliant formulated with natural ingredients for UV protection.,"vegan, anti-aging, beauty, organic, spf, clean-beauty",102.14
519,Scandinavian Picture Frame,Home Decor,Scandinavian Picture Frame that adds character and warmth to any bohemian space.,"aesthetic, boho, interior-design, home-decor, handmade, artisan",156.88
520,RGB Stream Deck,Gaming,Dominate the game with this RGB Stream Deck featuring customizable RGB lighting.,"esports, controller, gaming, streamer",315.83
